{
  "schema_version": "1.0.0",
  "capsule_id": "nmlt-intent-capsule-v1:sha256:27f17415113ceaebd6b8d88564dd28c120759c6a4ac6c9e9cfb52c54236d8716",
  "case_id": "dispatch-before-authorize",
  "case_class": "semantic_mutant",
  "source": {
    "path": "benchmarks/seeded-defects/provider-attempt/dispatch-before-authorize.nmlt",
    "source_id": "nmlt-source-v1:sha256:7ec7bc86cf7569c63caa1a87493e3bdb0f9af5b06cef5c60309e4d3d5632d578"
  },
  "provenance_id": "nmlt-benchmark-provenance-v1:sha256:957b1a6a5727b50ff19fa0b90cc3ec8413c7e31fad4d849d9498d685080a7105",
  "intent": "Demonstrate that dispatch without prior arming violates the provider authority boundary.",
  "property_ids": [
    "nmlt-benchmark-property-v1:sha256:52ad13dda5c9023da2ac4142673e4d24db34a98e2d201b9b9795fcbfae4763bd"
  ],
  "positive_scenarios": [
    "take dispatch immediately from proposed with armed equal to false"
  ],
  "forbidden_scenarios": [
    "classify structural acceptance as semantic acceptance",
    "repair the mutant or weaken DispatchRequiresArm during evaluation"
  ],
  "anti_vacuity_obligations": [
    "The unauthorized dispatch action is enabled in the initial state.",
    "The violating state is reachable in exactly one transition."
  ],
  "expected": {
    "current_evidence_class": "refuted",
    "intended_evidence_class": "refuted",
    "oracle_outcome": "refuted",
    "support": "current",
    "result": {
      "path": "benchmarks/results/provider-attempt/dispatch-before-authorize.json",
      "result_id": "nmlt-benchmark-result-v1:sha256:a3243ac5cda4573f81fe468f6f72c1ba410fa138cb66e930074f563e80ac65ba"
    },
    "witness_ids": [
      "nmlt-expected-counterexample-v1:sha256:ef750d2addd7c3dacb4d0095890c6f96037eb416238c98d5ff60ae1814f03627"
    ]
  },
  "change_control": {
    "status": "frozen",
    "frozen_on": "2026-07-18",
    "rule": "Changing intent, properties, source bytes, witness shape, or oracle requires a new suite version."
  }
}
