{
  "schema_version": "1.0.0",
  "capsule_id": "nmlt-intent-capsule-v1:sha256:6b47571c921477c4abfdfb978d4276a8d7fc35443f0cc37c287efde8028d7a11",
  "case_id": "response-binding",
  "case_class": "semantic_mutant",
  "source": {
    "path": "benchmarks/seeded-defects/provider-attempt/response-binding.nmlt",
    "source_id": "nmlt-source-v1:sha256:f750f47979e30377b2ed04b0f1e233196ca9429a09ceb53f3544158cc13794e6"
  },
  "provenance_id": "nmlt-benchmark-provenance-v1:sha256:957b1a6a5727b50ff19fa0b90cc3ec8413c7e31fad4d849d9498d685080a7105",
  "intent": "Demonstrate that evaluating without an intact response binding violates evidence integrity.",
  "property_ids": [
    "nmlt-benchmark-property-v1:sha256:15a3427faba0a4cf568c7bb01b98cf5ff750430d605d20c04dc8df80e7c64eb0"
  ],
  "positive_scenarios": [
    "take evaluate from dispatched while response_intact is false"
  ],
  "forbidden_scenarios": [
    "infer response binding from phase alone",
    "repair the mutant or weaken EvaluationRequiresIntactResponse during evaluation"
  ],
  "anti_vacuity_obligations": [
    "Evaluation is enabled in the initial state.",
    "The evaluated state with response_intact false is reachable in exactly one transition."
  ],
  "expected": {
    "current_evidence_class": "refuted",
    "intended_evidence_class": "refuted",
    "oracle_outcome": "refuted",
    "support": "current",
    "result": {
      "path": "benchmarks/results/provider-attempt/response-binding.json",
      "result_id": "nmlt-benchmark-result-v1:sha256:58124ad4424830d7fc3f365fc925b43a9d46845fa4e226a3369f0e505143cfad"
    },
    "witness_ids": [
      "nmlt-expected-counterexample-v1:sha256:18482ff41318611ea9dad3b239680d3026876be6d59bf7cd6380dc7bd9e1bb06"
    ]
  },
  "change_control": {
    "status": "frozen",
    "frozen_on": "2026-07-18",
    "rule": "Changing intent, properties, source bytes, witness shape, or oracle requires a new suite version."
  }
}
