{
  "schema_version": "1.0.0",
  "capsule_id": "nmlt-intent-capsule-v1:sha256:947b638b72f641470d445f4b0f99243ff9929d8777f663f563df0bebc874bcf1",
  "case_id": "passing-selection",
  "case_class": "semantic_mutant",
  "source": {
    "path": "benchmarks/seeded-defects/provider-attempt/passing-selection.nmlt",
    "source_id": "nmlt-source-v1:sha256:fb0145dc468ec9d587268193a03414461fb8d026823cd4f12d4a959a8bf2bfc6"
  },
  "provenance_id": "nmlt-benchmark-provenance-v1:sha256:957b1a6a5727b50ff19fa0b90cc3ec8413c7e31fad4d849d9498d685080a7105",
  "intent": "Demonstrate that selecting an evaluation that did not pass violates the selection gate.",
  "property_ids": [
    "nmlt-benchmark-property-v1:sha256:03a2a2ee37e3191d1f81ca722e60fb600efc60310c4855196904f0fd6ada7ba6"
  ],
  "positive_scenarios": [
    "take select immediately from evaluated while passed is false"
  ],
  "forbidden_scenarios": [
    "treat reaching evaluated as equivalent to passing",
    "repair the mutant or weaken SelectionRequiresPass during evaluation"
  ],
  "anti_vacuity_obligations": [
    "Selection is enabled in the initial state.",
    "The selected state with passed false is reachable in exactly one transition."
  ],
  "expected": {
    "current_evidence_class": "refuted",
    "intended_evidence_class": "refuted",
    "oracle_outcome": "refuted",
    "support": "current",
    "result": {
      "path": "benchmarks/results/provider-attempt/passing-selection.json",
      "result_id": "nmlt-benchmark-result-v1:sha256:b0571102a2338aa32849e71649ef92b0c36fe4baac323a47d5bdbb2f65edcb47"
    },
    "witness_ids": [
      "nmlt-expected-counterexample-v1:sha256:45bb21364362c8ab809b4366ac099ee2084fe89380f54df5f85ed1deab3e9c63"
    ]
  },
  "change_control": {
    "status": "frozen",
    "frozen_on": "2026-07-18",
    "rule": "Changing intent, properties, source bytes, witness shape, or oracle requires a new suite version."
  }
}
